{
  "$schema": "http://json-schema.org/draft-07/schema#",
  "$id": "avengers/memory-record.v1",
  "title": "avengers standing-memory record (v1)",
  "description": "One admitted STANDING memory record (design §6). Standing memory is project-tier, injected into seats at BLIND_DIVERGE (identity + standing only). A record is admissible ONLY when provenance.source_type is one of the four Codex-class sources AND its kind is not an episodic kind (seat opinion / refuted position / single-session conclusion). Seat opinions, refuted positions, and single-session conclusions live in EPISODIC history and are NEVER standing memory. Validated by the bundled stdlib mini-validator (subset: type/required/properties/items/enum/const/additionalProperties/minItems/minimum). DATA/machine state (stdlib JSON), never executed. Home-tier only: standing.json lives at ~/.claude/projects/<slug>/avengers/members/<seat-id>/ and is NEVER repo-local (pre-poisoned-clone vector).",
  "type": "object",
  "additionalProperties": false,
  "required": [
    "id", "topic_key", "kind", "statement", "applies_when",
    "provenance", "approval", "status"
  ],
  "properties": {
    "id": { "type": "string" },
    "topic_key": { "type": "string" },
    "kind": {
      "type": "string",
      "enum": ["constraint", "artifact_fact", "decision", "outcome"]
    },
    "statement": { "type": "string" },
    "applies_when": { "type": "string" },
    "provenance": {
      "type": "object",
      "additionalProperties": false,
      "required": ["run_id", "source_type", "source_refs", "sha256"],
      "properties": {
        "run_id": { "type": "string" },
        "source_type": {
          "type": "string",
          "enum": [
            "user_confirmed_constraint",
            "verified_project_artifact",
            "user_selected_decision",
            "observed_outcome"
          ]
        },
        "source_refs": {
          "type": "array",
          "minItems": 1,
          "items": { "type": "string" }
        },
        "sha256": { "type": "string" }
      }
    },
    "approval": {
      "type": "object",
      "additionalProperties": false,
      "required": ["status", "by", "at"],
      "properties": {
        "status": { "type": "string", "enum": ["proposed", "approved", "rejected"] },
        "by": { "type": "string" },
        "at": { "type": ["string", "null"] }
      }
    },
    "sensitivity": {
      "type": "object",
      "additionalProperties": false,
      "properties": {
        "pii": { "type": "boolean" }
      }
    },
    "status": { "type": "string", "enum": ["active", "superseded", "expired"] },
    "expires_at": { "type": ["string", "null"] },
    "supersedes": { "type": ["string", "null"] }
  }
}
